{
  "contract_id": "domain-data-products",
  "contract_version": "1.0.0",
  "governed_by_rfc": "RFC-0084",
  "producer_repository": "lotus-performance",
  "authoritative_domain": "performance_analytics",
  "products": [
    {
      "product_name": "ReturnsSeriesBundle",
      "product_version": "v1",
      "owner_repository": "lotus-performance",
      "product_family": "analytics_output",
      "authoritative_domain": "performance_analytics",
      "lifecycle_status": "active",
      "request_scope": { "scope_level": "portfolio", "supports_bulk": false },
      "temporal_scope": {
        "primary_time_field": "date",
        "freshness_basis": "valuation_date",
        "supports_restatement": true
      },
      "required_trust_metadata": [
        "product_name",
        "product_version",
        "generated_at",
        "as_of_date",
        "correlation_id"
      ],
      "current_routes": [
        "/integration/returns/series",
        "/integration/returns/series/results/{calculation_id}"
      ],
      "freshness_policy": {
        "freshness_class": "daily",
        "max_allowed_age_description": "Stateful series are recalculated from governed upstream data for the requested as-of date and window."
      },
      "completeness_policy": { "default_status": "complete", "partial_allowed": true },
      "lineage_policy": { "lineage_required": true, "evidence_bundle_required": false },
      "security_profile_ref": "system_access:client_confidential:retain_for_client_record:audit_system_access",
      "approved_consumers": ["lotus-risk"],
      "deprecation_policy": { "state": "not_deprecated", "successor_product": null }
    },
    {
      "product_name": "BenchmarkExposureContext",
      "product_version": "v1",
      "owner_repository": "lotus-performance",
      "product_family": "analytics_output",
      "authoritative_domain": "performance_analytics",
      "lifecycle_status": "active",
      "request_scope": { "scope_level": "benchmark", "supports_bulk": false },
      "temporal_scope": {
        "primary_time_field": "valuation_date",
        "freshness_basis": "valuation_date",
        "supports_restatement": true
      },
      "required_trust_metadata": [
        "product_name",
        "product_version",
        "generated_at",
        "as_of_date"
      ],
      "current_routes": ["/integration/benchmarks/exposure-context"],
      "freshness_policy": {
        "freshness_class": "daily",
        "max_allowed_age_description": "Exposure rows must stay aligned to the benchmark performance context and resolved benchmark version for the requested as-of date."
      },
      "completeness_policy": { "default_status": "complete", "partial_allowed": true },
      "lineage_policy": { "lineage_required": true, "evidence_bundle_required": false },
      "security_profile_ref": "system_access:reference_internal:retain_for_source_audit:audit_system_access",
      "approved_consumers": ["lotus-risk"],
      "deprecation_policy": { "state": "not_deprecated", "successor_product": null }
    }
  ]
}
